artist_name,description,artist_description,title,region,user_tags,image_url,thumbnail,permalink,doc,machine_tags,user_tags_synsets_superclusters_formatted,user_tags_synsets_superclusters_no_scores,user_tags_synsets_superclusters_sum_of_scores,user_tags_synsets_clusters_formatted,user_tags_synsets_clusters_no_scores,user_tags_synsets_clusters_sum_of_scores,machine_tags_synsets_superclusters_formatted,machine_tags_synsets_superclusters_no_scores,machine_tags_synsets_superclusters_sum_of_scores,machine_tags_synsets_clusters_formatted,machine_tags_synsets_clusters_no_scores,machine_tags_synsets_clusters_sum_of_scores
"Jennifer Allora, Guillermo Calzadilla","This series of photographs is part of the body of work Allora & Calzadilla made regarding the situation in Vieques, an island off the mainland of Puerto Rico used for the 60 years by the U.S Military and NATO forces to practice military bombing exercises. In 2000, they began a collaboration with the local activists to make the campaign more visible. Having added cast rubber reliefs of their slogans and designs to the soles of their shoes, the activists stamped their protest on the reclaimed land. By slightly manipulating everyday objects to become communication tools, Allora & Calzadilla had created “mobile print-making machines” (Yates McKee, October 133, Summer 2010). They then photographed the ephemeral aftermath of these mark-making actions.  Like graffitied walls, the details of these impressions on sandy grounds are landscapes of dissent, willing the transition of propriety back to the inhabitants. In Land Mark #12, numerous footsteps with long statements stamp their resentment in different confused orientations. Such a beach scene might at first misleadingly be associated with a playful holiday snap. The fragility, uncertainty and relentlessness of this struggle is poetically summarized in this close-up of meaningful site-specific expression. The artists wrote: “How is land differentiated from other land by the way it is marked? Who decides what is worth preserving and what should be destroyed? What are the strategies for reclaiming marked land? How does one articulate an ethics and politics of land use?” (in Land Mark, de Tokyo, Paris, 2006).","Jennifer Allora and Guillermo Calzadilla comprise the artistic duo Allora & Calzadilla. Their work often takes the form of performances, installations, and sound pieces that refer to sociopolitical phenomena and history. Forms from these spheres of life—an overturned tank, a treadmill, a piano—are displaced and spliced together in new configurations, often with performers or viewers engaging with these material segments of the world.",Land Mark (Foot Prints) #12,Americas,"['demobilization.n.01', 'landscape.n.03', 'footprint.n.02', 'intervention.n.01', 'documentation.n.01', 'trace.n.02']",https://kadist.org/wp-content/uploads/2016/04/img-34.jpg,https://kadist.org/wp-content/uploads/2016/04/img-34-300x200.jpg,https://kadist.org/work/land-mark-foot-prints-12/,"This series of photographs is part of the body of work Allora & Calzadilla made regarding the situation in Vieques, an island off the mainland of Puerto Rico used for the 60 years by the U.S Military and NATO forces to practice military bombing exercises. In 2000, they began a collaboration with the local activists to make the campaign more visible. Having added cast rubber reliefs of their slogans and designs to the soles of their shoes, the activists stamped their protest on the reclaimed land. By slightly manipulating everyday objects to become communication tools, Allora & Calzadilla had created “mobile print-making machines” (Yates McKee, October 133, Summer 2010). They then photographed the ephemeral aftermath of these mark-making actions.  Like graffitied walls, the details of these impressions on sandy grounds are landscapes of dissent, willing the transition of propriety back to the inhabitants. In Land Mark #12, numerous footsteps with long statements stamp their resentment in different confused orientations. Such a beach scene might at first misleadingly be associated with a playful holiday snap. The fragility, uncertainty and relentlessness of this struggle is poetically summarized in this close-up of meaningful site-specific expression. The artists wrote: “How is land differentiated from other land by the way it is marked? Who decides what is worth preserving and what should be destroyed? What are the strategies for reclaiming marked land? How does one articulate an ethics and politics of land use?” (in Land Mark, de Tokyo, Paris, 2006).. Jennifer Allora and Guillermo Calzadilla comprise the artistic duo Allora & Calzadilla. Their work often takes the form of performances, installations, and sound pieces that refer to sociopolitical phenomena and history. Forms from these spheres of life—an overturned tank, a treadmill, a piano—are displaced and spliced together in new configurations, often with performers or viewers engaging with these material segments of the world.. Land Mark (Foot Prints) #12.","['puerto_rico.n.01', 'land.v.01', 'cross_off.v.01', 'mark.n.04', 'visible.s.02', 'vieques.n.01', 'doubt.n.01', 'treadmill.n.01', 'passage.n.01', 'tokyo.n.01', 'remove.v.01', 'struggle.n.01', 'strategy.n.02', 'marry.v.02', 'sphere.n.02', 'sole.n.04', 'motto.n.01', 'situation.n.01', 'brake_shoe.n.01', 'series.n.03', 'resentment.n.01', 'relentlessness.n.01', 'refer.v.02', 'protest.n.01', 'propriety.n.01', 'politics.n.01', 'photograph.v.02', 'photograph.v.02', 'performer.n.01', 'performance.n.01', 'paris.n.01', 'deceptively.r.01', 'military.a.01', 'meaningful.a.01', 'mainland.n.01', 'landscape.n.04', 'island.n.01', 'initiation.n.01', 'inhabitant.n.01', 'impression.n.06', 'history.n.04', 'fragility.n.01', 'form.n.01', 'form.n.01', 'ethics.n.02', 'dissent.v.01', 'move.v.02', 'detail.n.04', 'demolish.v.03', 'design.v.05', 'decide.v.03', 'shape.n.01', 'collaboration.n.02', 'close.v.10', 'campaign.n.02', 'body.n.06', 'joint.v.02', 'action.n.09']","['Cultural/4.920751633986928', 'Society/1.75', 'Politics/1.6985294117647058']","['Cultural', 'Society', 'Politics']",8.369281045751634,"['Arts/4.0318627450980395', 'Inequality/1.6985294117647058', 'Land/1.0']","['Arts', 'Inequality', 'Land']",6.730392156862745,"['Cultural/23.863326869209235', 'Society/15.965060086112722', 'Individual_Personal/8.835947712418301']","['Cultural', 'Society', 'Individual_Personal']",48.66433466774026,"['Technology/9.607843137254902', 'Arts/4.796631473102061', 'Urbanization/4.1089133089133085']","['Technology', 'Arts', 'Urbanization']",18.513387919270272
Gabriel Kuri,"Gabriel Kuri has created a series of works in which he juxtaposes perennial and ephemeral materials. Untitled (Ticket Roll) belongs to this group of sculptures and consists of three smooth ornate marble elements and a roll of public transport tickets. The artist poetically associates finesse and fragility as in a number of these works. Here the line of the ticket roll, partly unraveled, is held down by the balancing marble elements thus creating an interdependence between elements de different natures. Gabriel Kuri’s sculptural work involves a narrative through various elements from daily life resulting from specific areas of our contemporary social structures : tickets, banknotes, bills, credit cards, toiletry samples from hotels…","Gabriel Kuri works from repurposed natural, industrial, and mass-produced objects and materials including soda cans, shopping bags, receipts, insulation foam, shells, and magazines. Focusing his attention – through almost Dadaist means – on consumer culture, Kuri playfully charts transactions and creates systems that speak about both everyday life and the global economy. His practice is often site-specific and refers to the site of exhibition. Kuri lives and works between Mexico and Brussels.",Untitled (Ticket Roll),Unspecified,"['everyday.s.03', 'ostentatious.a.01', 'juxtaposition.n.01', 'tension.n.03', 'ephemeral.s.01', 'perennial.s.02']",https://kadist.org/wp-content/uploads/2016/04/gabrielkuri.jpg,https://kadist.org/wp-content/uploads/2016/04/gabrielkuri-300x225.jpg,https://kadist.org/work/untitled-ticket-roll/,"Gabriel Kuri has created a series of works in which he juxtaposes perennial and ephemeral materials. Untitled (Ticket Roll) belongs to this group of sculptures and consists of three smooth ornate marble elements and a roll of public transport tickets. The artist poetically associates finesse and fragility as in a number of these works. Here the line of the ticket roll, partly unraveled, is held down by the balancing marble elements thus creating an interdependence between elements de different natures. Gabriel Kuri’s sculptural work involves a narrative through various elements from daily life resulting from specific areas of our contemporary social structures : tickets, banknotes, bills, credit cards, toiletry samples from hotels…. Gabriel Kuri works from repurposed natural, industrial, and mass-produced objects and materials including soda cans, shopping bags, receipts, insulation foam, shells, and magazines. Focusing his attention – through almost Dadaist means – on consumer culture, Kuri playfully charts transactions and creates systems that speak about both everyday life and the global economy. His practice is often site-specific and refers to the site of exhibition. Kuri lives and works between Mexico and Brussels.. Untitled (Ticket Roll).","['shopping_bag.n.01', 'credit_card.n.01', 'ticket.v.02', 'roll.v.17', 'element.n.07', 'specific.s.02', 'talk.v.02', 'shell.n.01', 'series.n.03', 'sculpt.v.02', 'sculptural.a.01', 'refer.v.02', 'receipt.n.02', 'drill.v.03', 'nature.n.05', 'narrative.s.01', 'mexico.n.01', 'mass.n.01', 'magazine.n.05', 'involve.v.05', 'mutuality.n.02', 'industrial.s.03', 'restrain.v.03', 'fragility.n.01', 'focus.v.04', 'make.v.03', 'make.v.03', 'dwell.v.02', 'bill.n.01', 'belong.v.05', 'bill.n.03']",['Material_Physical/1.0'],['Material_Physical'],1.0,['Time/1.0'],['Time'],1.0,"['Material_Physical/6.119883040935672', 'Cultural/3.3204238217025943', 'Society/1.6013071895424837']","['Material_Physical', 'Cultural', 'Society']",11.04161405218075,"['Land/2.6198830409356724', 'Physics/1.6666666666666667', 'Design/1.639751552795031']","['Land', 'Physics', 'Design']",5.92630126039737
Renee Rhodes,"The artist writes about her work: “There is an endless desire to know what we look like from outer space and many of us have evolved into a species that exists across the disorienting spaces and timeframes of virtuality. Within my current work, dance and simple movement scores act as a language for simultaneously collecting, mapping and producing volumes of information and knowledge. Moving makes a map and performing is observation. Digital mediations translate bodies into uncanny organisms and minimal dances become distant accumulations of pixelated information. Entanglements between human physicality, technology and natural systems are imagined through a playful aesthetics of information. As every last body and landscape is mapped and measured, through rigorous technologies of ever increasing distance, I look for the newly emerging territories that mineralize at the intersections of the virtual and the physical. These are the territories that we live in, archived in the memory drives of muscles, or through endlessly shifting choreographies of information.”","Renée Rhodes grew up amidst the fantasy and rigor that is the world of classical ballet. Choreography, organization and the use of movement as a communicative language continues to be a primary influence in her current video, performance and book based works.",Moving Clocks Change Rhythm,Americas,"['map.v.02', 'choreography.n.02', 'perspective.n.02', 'information.n.02', 'video_recording.n.01', 'performance.n.03']",https://kadist.org/wp-content/uploads/2016/04/renee_rhodes_moving_clocks.jpg,https://kadist.org/wp-content/uploads/2016/04/renee_rhodes_moving_clocks-200x300.jpg,https://kadist.org/work/moving-clocks-change-rhythm/,"The artist writes about her work: “There is an endless desire to know what we look like from outer space and many of us have evolved into a species that exists across the disorienting spaces and timeframes of virtuality. Within my current work, dance and simple movement scores act as a language for simultaneously collecting, mapping and producing volumes of information and knowledge. Moving makes a map and performing is observation. Digital mediations translate bodies into uncanny organisms and minimal dances become distant accumulations of pixelated information. Entanglements between human physicality, technology and natural systems are imagined through a playful aesthetics of information. As every last body and landscape is mapped and measured, through rigorous technologies of ever increasing distance, I look for the newly emerging territories that mineralize at the intersections of the virtual and the physical. These are the territories that we live in, archived in the memory drives of muscles, or through endlessly shifting choreographies of information.”. Renée Rhodes grew up amidst the fantasy and rigor that is the world of classical ballet. Choreography, organization and the use of movement as a communicative language continues to be a primary influence in her current video, performance and book based works.. Moving Clocks Change Rhythm.","['outer_space.n.01', 'classical_ballet.n.01', 'district.n.01', 'movement.n.05', 'linguistic_process.n.02', 'current.n.01', 'write.v.04', 'virtual.s.01', 'technology.n.01', 'species.n.02', 'severity.n.04', 'physical.s.05', 'perform.v.02', 'performance.n.01', 'organization.n.05', 'observation.n.04', 'muscle.n.01', 'move.v.11', 'mineralize.v.01', 'measure.v.04', 'map.v.06', 'map.v.06', 'map.v.06', 'live.r.01', 'landscape.n.04', 'cognition.n.01', 'intersection.n.01', 'think.v.02', 'fantasy.n.02', 'exist.v.01', 'develop.v.03', 'web.n.02', 'dance.n.01', 'choreography.n.03', 'body.n.06', 'archive.v.01']","['Cultural/4.927287581699346', 'Material_Physical/0.7777777777777778']","['Cultural', 'Material_Physical']",5.705065359477124,"['Arts/4.1495098039215685', 'Culture/0.7777777777777778', 'Land/0.7777777777777778']","['Arts', 'Culture', 'Land']",5.705065359477124,"['Cultural/11.23608352431882', 'Material_Physical/10.08864468864469', 'Society/7.663736263736263']","['Cultural', 'Material_Physical', 'Society']",28.988464476699775,"['Urbanization/6.894505494505494', 'Land/6.7194139194139195', 'Arts/5.982981071216365']","['Urbanization', 'Land', 'Arts']",19.596900485135777
Fiamma Montezemolo,"Montemozolo writes of the work: “Fireflies is the result of a sudden event—and its transformation/translation into an art work—that erupts within a life, altering its flow, suspending it, creating a momentary intensity and deviation of the flow, channeling it somewhere unexpected. This unforeseen deviation is dissected in terms of affects in the time frame of 5 minutes. The affects that emerge in the piece are characterized by a sense of movement between pain and hope, and a work of association between cancer and expectancy. The concept of resistance and fireflies is taken from [Georges] Didi-Huberman’s work on the political relevance of the survival of fireflies as a metaphor for the contemporary importance of an intermittent resistance opposed to an inoperable, redemptive, absolute one.”","Born in Rome, Fiamma Montezemolo is both a cultural anthropologist (PhD, University of Naples)  and an artist (MFA, San Francisco Art Institute). Not surprisingly then, she situates her art practice as a critical response to the “ethnographic turn” that was prevalent in contemporary art during the 1990s. In addition to ethnography—a research method adopted as a “medium” by many artists—Montezemolo works with various media including installation, cartography, video, digital photography, industrial materials, performance, and archival documents. Her art practice straddles various disciplines, sensibilities, and methodologies, including institutional critique, social art, and indigenous media.",Fireflies,Americas,"['survival.n.01', 'adjust.v.03', 'surprise.n.02', 'cancer.n.01', 'deviation.n.01', 'hope.n.01']",https://kadist.org/wp-content/uploads/2016/04/fiamma_montezemolo_fireflies.jpg.jpeg,https://kadist.org/wp-content/uploads/2016/04/fiamma_montezemolo_fireflies.jpg-300x225.jpeg,https://kadist.org/work/fireflies/,"Montemozolo writes of the work: “Fireflies is the result of a sudden event—and its transformation/translation into an art work—that erupts within a life, altering its flow, suspending it, creating a momentary intensity and deviation of the flow, channeling it somewhere unexpected. This unforeseen deviation is dissected in terms of affects in the time frame of 5 minutes. The affects that emerge in the piece are characterized by a sense of movement between pain and hope, and a work of association between cancer and expectancy. The concept of resistance and fireflies is taken from [Georges] Didi-Huberman’s work on the political relevance of the survival of fireflies as a metaphor for the contemporary importance of an intermittent resistance opposed to an inoperable, redemptive, absolute one.”. Born in Rome, Fiamma Montezemolo is both a cultural anthropologist (PhD, University of Naples)  and an artist (MFA, San Francisco Art Institute). Not surprisingly then, she situates her art practice as a critical response to the “ethnographic turn” that was prevalent in contemporary art during the 1990s. In addition to ethnography—a research method adopted as a “medium” by many artists—Montezemolo works with various media including installation, cartography, video, digital photography, industrial materials, performance, and archival documents. Her art practice straddles various disciplines, sensibilities, and methodologies, including institutional critique, social art, and indigenous media.. Fireflies.","['time_frame.n.01', 'san_francisco.n.01', 'digital_photography.n.01', 'social_anthropologist.n.01', 'resistance.n.01', 'drill.v.03', 'firefly.n.01', 'deviation.n.04', 'television.n.01', 'university.n.03', 'unexpected.a.01', 'translation.n.05', 'transformation.n.04', 'term.n.01', 'suspend.v.01', 'survival.n.02', 'surprisingly.r.01', 'social.a.01', 'situate.v.01', 'sensitivity.n.01', 'smell.v.05', 'rome.n.02', 'result.v.01', 'redemptive.s.02', 'prevailing.s.01', 'piece.v.05', 'ph.d..n.01', 'performance.n.01', 'pain.v.02', 'naples.n.01', 'movement.n.05', 'master_of_fine_arts.n.01', 'methodology.n.01', 'method_acting.n.01', 'metaphor.n.01', 'life.n.08', 'inoperable.a.02', 'hope.n.02', 'george.n.07', 'menstruation.n.01', 'anticipation.n.01', 'erupt.v.04', 'emerge.v.03', 'dissect.v.01', 'discipline.n.01', 'make.v.03', 'contemporary.n.01', 'concept.n.01', 'qualify.v.06', 'transmit.v.04', 'mapmaking.n.01', 'cancer.n.03', 'bear.v.01', 'association.n.06', 'neutering.n.01', 'addition.n.01', 'absolute.a.01']","['Individual_Personal/1.6923076923076925', 'Material_Physical/1.5384615384615385']","['Individual_Personal', 'Material_Physical']",3.230769230769231,"['Materiality/1.5384615384615385', 'Body/0.9230769230769231', 'Spirituality/0.7692307692307693']","['Materiality', 'Body', 'Spirituality']",3.230769230769231,"['Individual_Personal/8.760159448394742', 'Society/8.527856500224921', 'Cultural/7.706435394670688']","['Individual_Personal', 'Society', 'Cultural']",24.99445134329035,"['Time/3.3988095238095237', 'Body/3.2260935143288085', 'Media/2.723529411764706']","['Time', 'Body', 'Media']",9.348432449903038
Mladen Stilinovic,"The Exploitation of the Dead cycle is composed of a very large number of elements which the artist reorganizes differently every time. The installation is presented like a “parade of objects”, with images whose historical role has been suspended or their meaning has changed. The references have become lost, through repetition the works have become banal. One can find copies of Suprematist or Social Realist paintings, collages, photographs of political meetings, cemeteries or other memorials. We are confronted with the obsolescence of signs. Colors like red and black have also lost their meaning.  Exploitation of the Dead concerns today’s religious or ideological ideas which are only extensions of religions and ideologies of the past and definitively dead. Mladen Stilinovic insists that: “If death has to be exploited, this is a violent act and we need to weigh up the consequences.” Collective rituals are central since they evoke a certain collective emotion which can’t quite be attained through signs and colors. This work is a way to think about painting but also the modalities of its exhibition. There is also this question of the copy. Why and how do we copy things? What do we learn through repetition ? About loss of integrity ?","Mladen Stilinovic’s work is based on social and political critique, with a healthy dose of irony. He was part of Grupa šestorice autora (Group of Six Authors), active in Zagreb between 1975 and 1979. He also ran the Extended Media Gallery from 1981 to 1991. His work is deeply rooted in the rites that reveal the interdependence of private and public spheres. He is particularly interested in the interaction between visual and linguistic signs as well as in the mechanisms of deconstruction in language. His polymorphic approach finds varied manifestations from collages, installations, photographs, books, performances, actions in public space as well as participations in collective actions.  Mladen Stilinovic was born in 1947 in Belgrade, Serbia. He lives and works in Zagreb, Croatia.",Exploitation of the Dead,Europe,"['obsoleteness.n.01', 'meaning.n.01', 'collection.n.01', 'circulation.n.06', 'copy.n.02', 'ideology.n.02']",https://kadist.org/wp-content/uploads/2016/04/par_1.jpg,https://kadist.org/wp-content/uploads/2016/04/par_1-300x177.jpg,https://kadist.org/work/exploitation-of-the-dead/,"The Exploitation of the Dead cycle is composed of a very large number of elements which the artist reorganizes differently every time. The installation is presented like a “parade of objects”, with images whose historical role has been suspended or their meaning has changed. The references have become lost, through repetition the works have become banal. One can find copies of Suprematist or Social Realist paintings, collages, photographs of political meetings, cemeteries or other memorials. We are confronted with the obsolescence of signs. Colors like red and black have also lost their meaning.  Exploitation of the Dead concerns today’s religious or ideological ideas which are only extensions of religions and ideologies of the past and definitively dead. Mladen Stilinovic insists that: “If death has to be exploited, this is a violent act and we need to weigh up the consequences.” Collective rituals are central since they evoke a certain collective emotion which can’t quite be attained through signs and colors. This work is a way to think about painting but also the modalities of its exhibition. There is also this question of the copy. Why and how do we copy things? What do we learn through repetition ? About loss of integrity ?. Mladen Stilinovic’s work is based on social and political critique, with a healthy dose of irony. He was part of Grupa šestorice autora (Group of Six Authors), active in Zagreb between 1975 and 1979. He also ran the Extended Media Gallery from 1981 to 1991. His work is deeply rooted in the rites that reveal the interdependence of private and public spheres. He is particularly interested in the interaction between visual and linguistic signs as well as in the mechanisms of deconstruction in language. His polymorphic approach finds varied manifestations from collages, installations, photographs, books, performances, actions in public space as well as participations in collective actions.  Mladen Stilinovic was born in 1947 in Belgrade, Serbia. He lives and works in Zagreb, Croatia.. Exploitation of the Dead.","['dead.s.07', 'social.a.01', 'sign.n.11', 'action.n.09', 'zagreb.n.01', 'weigh.v.05', 'ocular.a.02', 'violent.s.02', 'clock.v.01', 'suspend.v.01', 'suprematist.n.01', 'serbia.n.01', 'rite.n.01', 'unwrap.v.02', 'repetition.n.03', 'reorganize.v.02', 'religious.n.01', 'religion.n.02', 'reference_point.n.01', 'loss.n.06', 'question.n.02', 'private.a.01', 'photograph.v.02', 'performance.n.01', 'participation.n.02', 'obsolescence.n.01', 'modality.n.04', 'memorial.n.01', 'mechanism.n.05', 'mean.v.03', 'doomed.n.01', 'loss.n.01', 'life.n.08', 'determine.v.08', 'linguistic_process.n.02', 'irony.n.02', 'mutuality.n.02', 'interaction.n.01', 'initiation.n.01', 'image.n.07', 'ideology.n.02', 'annex.n.01', 'exploited.a.01', 'exploitation.n.01', 'raise.v.07', 'element.n.07', 'deconstruction.n.01', 'death.n.03', 'transcript.n.02', 'confront.v.02', 'compose.v.01', 'color.v.01', 'collage.n.01', 'changed.s.03', 'central.n.01', 'cemetery.n.01', 'bear.v.01', 'bible.n.01', 'black.n.01', 'belgrade.n.01', 'based.s.02', 'banal.s.01', 'fall_upon.v.01']","['Individual_Personal/1.6333333333333333', 'Material_Physical/0.8333333333333334', 'Cultural/0.8']","['Individual_Personal', 'Material_Physical', 'Cultural']",3.2666666666666666,"['Body/0.8333333333333334', 'Time/0.8333333333333334', 'Emotion/0.8']","['Body', 'Time', 'Emotion']",2.466666666666667,"['Material_Physical/6.421978021978021', 'Society/5.907692307692308', 'Cultural/2.3384615384615386']","['Material_Physical', 'Society', 'Cultural']",14.668131868131868,"['Land/6.421978021978021', 'Urbanization/2.5692307692307694', 'Spirituality/2.0']","['Land', 'Urbanization', 'Spirituality']",10.991208791208791
